{"$schema":"https://json-schema.org/draft/2020-12/schema","title":"Puntos del mapa","type":"array","items":{"type":"object","required":["type","name","destination","query","lat","lng"],"properties":{"type":{"type":"string"},"name":{"type":"string"},"destination":{"type":"string"},"query":{"type":"string"},"lat":{"type":"number","minimum":-90,"maximum":90},"lng":{"type":"number","minimum":-180,"maximum":180},"approximate":{"type":"boolean"}}}}
